{
  "$schema":"https://json-schema.org/draft/2020-12/schema","$id":"use-case-score.schema.json","type":"object",
  "required":["product_id","use_case","score","method_version","updated_at"],
  "properties":{"product_id":{"type":"string"},"use_case":{"type":"string"},"score":{"type":"integer","minimum":0,"maximum":100},"reason":{"type":"string"},"method_version":{"type":"string"},"updated_at":{"type":"string"}}
}
