[
  {
    "product_id": "digitalocean-basic-16gb",
    "use_case": "wordpress",
    "score": 80,
    "reason": "Editorial fit score v2; objective eligibility, capacity, price, and management filters are evaluated separately.",
    "method_version": "2.0",
    "updated_at": "2026-08-24"
  },
  {
    "product_id": "digitalocean-basic-16gb",
    "use_case": "woocommerce",
    "score": 86,
    "reason": "Editorial fit score v2; objective eligibility, capacity, price, and management filters are evaluated separately.",
    "method_version": "2.0",
    "updated_at": "2026-08-24"
  },
  {
    "product_id": "digitalocean-basic-16gb",
    "use_case": "website",
    "score": 82,
    "reason": "Editorial fit score v2; objective eligibility, capacity, price, and management filters are evaluated separately.",
    "method_version": "2.0",
    "updated_at": "2026-08-24"
  },
  {
    "product_id": "digitalocean-basic-16gb",
    "use_case": "developer",
    "score": 95,
    "reason": "Editorial fit score v2; objective eligibility, capacity, price, and management filters are evaluated separately.",
    "method_version": "2.0",
    "updated_at": "2026-08-24"
  },
  {
    "product_id": "digitalocean-basic-16gb",
    "use_case": "game",
    "score": 84,
    "reason": "Editorial fit score v2; objective eligibility, capacity, price, and management filters are evaluated separately.",
    "method_version": "2.0",
    "updated_at": "2026-08-24"
  },
  {
    "product_id": "digitalocean-basic-16gb",
    "use_case": "temporary",
    "score": 94,
    "reason": "Editorial fit score v2; objective eligibility, capacity, price, and management filters are evaluated separately.",
    "method_version": "2.0",
    "updated_at": "2026-08-24"
  },
  {
    "product_id": "digitalocean-basic-1gb",
    "use_case": "wordpress",
    "score": 40,
    "reason": "Editorial fit score v2; objective eligibility, capacity, price, and management filters are evaluated separately.",
    "method_version": "2.0",
    "updated_at": "2026-08-24"
  },
  {
    "product_id": "digitalocean-basic-1gb",
    "use_case": "woocommerce",
    "score": 32,
    "reason": "Editorial fit score v2; objective eligibility, capacity, price, and management filters are evaluated separately.",
    "method_version": "2.0",
    "updated_at": "2026-08-24"
  },
  {
    "product_id": "digitalocean-basic-1gb",
    "use_case": "website",
    "score": 82,
    "reason": "Editorial fit score v2; objective eligibility, capacity, price, and management filters are evaluated separately.",
    "method_version": "2.0",
    "updated_at": "2026-08-24"
  },
  {
    "product_id": "digitalocean-basic-1gb",
    "use_case": "developer",
    "score": 95,
    "reason": "Editorial fit score v2; objective eligibility, capacity, price, and management filters are evaluated separately.",
    "method_version": "2.0",
    "updated_at": "2026-08-24"
  },
  {
    "product_id": "digitalocean-basic-1gb",
    "use_case": "game",
    "score": 59,
    "reason": "Editorial fit score v2; objective eligibility, capacity, price, and management filters are evaluated separately.",
    "method_version": "2.0",
    "updated_at": "2026-08-24"
  },
  {
    "product_id": "digitalocean-basic-1gb",
    "use_case": "temporary",
    "score": 94,
    "reason": "Editorial fit score v2; objective eligibility, capacity, price, and management filters are evaluated separately.",
    "method_version": "2.0",
    "updated_at": "2026-08-24"
  },
  {
    "product_id": "digitalocean-basic-2gb-1vcpu",
    "use_case": "wordpress",
    "score": 75,
    "reason": "Editorial fit score v2; objective eligibility, capacity, price, and management filters are evaluated separately.",
    "method_version": "2.0",
    "updated_at": "2026-08-24"
  },
  {
    "product_id": "digitalocean-basic-2gb-1vcpu",
    "use_case": "woocommerce",
    "score": 67,
    "reason": "Editorial fit score v2; objective eligibility, capacity, price, and management filters are evaluated separately.",
    "method_version": "2.0",
    "updated_at": "2026-08-24"
  },
  {
    "product_id": "digitalocean-basic-2gb-1vcpu",
    "use_case": "website",
    "score": 82,
    "reason": "Editorial fit score v2; objective eligibility, capacity, price, and management filters are evaluated separately.",
    "method_version": "2.0",
    "updated_at": "2026-08-24"
  },
  {
    "product_id": "digitalocean-basic-2gb-1vcpu",
    "use_case": "developer",
    "score": 95,
    "reason": "Editorial fit score v2; objective eligibility, capacity, price, and management filters are evaluated separately.",
    "method_version": "2.0",
    "updated_at": "2026-08-24"
  },
  {
    "product_id": "digitalocean-basic-2gb-1vcpu",
    "use_case": "game",
    "score": 59,
    "reason": "Editorial fit score v2; objective eligibility, capacity, price, and management filters are evaluated separately.",
    "method_version": "2.0",
    "updated_at": "2026-08-24"
  },
  {
    "product_id": "digitalocean-basic-2gb-1vcpu",
    "use_case": "temporary",
    "score": 94,
    "reason": "Editorial fit score v2; objective eligibility, capacity, price, and management filters are evaluated separately.",
    "method_version": "2.0",
    "updated_at": "2026-08-24"
  },
  {
    "product_id": "digitalocean-basic-2gb-2vcpu",
    "use_case": "wordpress",
    "score": 75,
    "reason": "Editorial fit score v2; objective eligibility, capacity, price, and management filters are evaluated separately.",
    "method_version": "2.0",
    "updated_at": "2026-08-24"
  },
  {
    "product_id": "digitalocean-basic-2gb-2vcpu",
    "use_case": "woocommerce",
    "score": 67,
    "reason": "Editorial fit score v2; objective eligibility, capacity, price, and management filters are evaluated separately.",
    "method_version": "2.0",
    "updated_at": "2026-08-24"
  },
  {
    "product_id": "digitalocean-basic-2gb-2vcpu",
    "use_case": "website",
    "score": 82,
    "reason": "Editorial fit score v2; objective eligibility, capacity, price, and management filters are evaluated separately.",
    "method_version": "2.0",
    "updated_at": "2026-08-24"
  },
  {
    "product_id": "digitalocean-basic-2gb-2vcpu",
    "use_case": "developer",
    "score": 95,
    "reason": "Editorial fit score v2; objective eligibility, capacity, price, and management filters are evaluated separately.",
    "method_version": "2.0",
    "updated_at": "2026-08-24"
  },
  {
    "product_id": "digitalocean-basic-2gb-2vcpu",
    "use_case": "game",
    "score": 59,
    "reason": "Editorial fit score v2; objective eligibility, capacity, price, and management filters are evaluated separately.",
    "method_version": "2.0",
    "updated_at": "2026-08-24"
  },
  {
    "product_id": "digitalocean-basic-2gb-2vcpu",
    "use_case": "temporary",
    "score": 94,
    "reason": "Editorial fit score v2; objective eligibility, capacity, price, and management filters are evaluated separately.",
    "method_version": "2.0",
    "updated_at": "2026-08-24"
  },
  {
    "product_id": "digitalocean-basic-4gb",
    "use_case": "wordpress",
    "score": 80,
    "reason": "Editorial fit score v2; objective eligibility, capacity, price, and management filters are evaluated separately.",
    "method_version": "2.0",
    "updated_at": "2026-08-24"
  },
  {
    "product_id": "digitalocean-basic-4gb",
    "use_case": "woocommerce",
    "score": 72,
    "reason": "Editorial fit score v2; objective eligibility, capacity, price, and management filters are evaluated separately.",
    "method_version": "2.0",
    "updated_at": "2026-08-24"
  },
  {
    "product_id": "digitalocean-basic-4gb",
    "use_case": "website",
    "score": 82,
    "reason": "Editorial fit score v2; objective eligibility, capacity, price, and management filters are evaluated separately.",
    "method_version": "2.0",
    "updated_at": "2026-08-24"
  },
  {
    "product_id": "digitalocean-basic-4gb",
    "use_case": "developer",
    "score": 95,
    "reason": "Editorial fit score v2; objective eligibility, capacity, price, and management filters are evaluated separately.",
    "method_version": "2.0",
    "updated_at": "2026-08-24"
  },
  {
    "product_id": "digitalocean-basic-4gb",
    "use_case": "game",
    "score": 84,
    "reason": "Editorial fit score v2; objective eligibility, capacity, price, and management filters are evaluated separately.",
    "method_version": "2.0",
    "updated_at": "2026-08-24"
  },
  {
    "product_id": "digitalocean-basic-4gb",
    "use_case": "temporary",
    "score": 94,
    "reason": "Editorial fit score v2; objective eligibility, capacity, price, and management filters are evaluated separately.",
    "method_version": "2.0",
    "updated_at": "2026-08-24"
  },
  {
    "product_id": "digitalocean-basic-512mb",
    "use_case": "wordpress",
    "score": 40,
    "reason": "Editorial fit score v2; objective eligibility, capacity, price, and management filters are evaluated separately.",
    "method_version": "2.0",
    "updated_at": "2026-08-24"
  },
  {
    "product_id": "digitalocean-basic-512mb",
    "use_case": "woocommerce",
    "score": 32,
    "reason": "Editorial fit score v2; objective eligibility, capacity, price, and management filters are evaluated separately.",
    "method_version": "2.0",
    "updated_at": "2026-08-24"
  },
  {
    "product_id": "digitalocean-basic-512mb",
    "use_case": "website",
    "score": 82,
    "reason": "Editorial fit score v2; objective eligibility, capacity, price, and management filters are evaluated separately.",
    "method_version": "2.0",
    "updated_at": "2026-08-24"
  },
  {
    "product_id": "digitalocean-basic-512mb",
    "use_case": "developer",
    "score": 95,
    "reason": "Editorial fit score v2; objective eligibility, capacity, price, and management filters are evaluated separately.",
    "method_version": "2.0",
    "updated_at": "2026-08-24"
  },
  {
    "product_id": "digitalocean-basic-512mb",
    "use_case": "game",
    "score": 59,